{
  "schema_version": "2.0-skill",
  "client": {
    "id": "tmp_c_001",
    "label": "Gronier",
    "entities": [
      {
        "id": "tmp_ent_001",
        "label": "Nicolas G.",
        "type": "pp",
        "order": 1
      },
      {
        "id": "tmp_ent_002",
        "label": "HANAMI INVESTISSEMENTS SAS",
        "type": "holding",
        "order": 2
      },
      {
        "id": "tmp_ent_003",
        "label": "SAS SHIDA",
        "type": "holding",
        "order": 3
      },
      {
        "id": "tmp_ent_004",
        "label": "SAS MATSU",
        "type": "holding",
        "order": 4
      }
    ]
  },
  "reporting": {
    "period_short": "T2 2026",
    "period_long": "Reporting au 30 juin 2026",
    "date_reporting": "2026-06-30",
    "date_display": "30 juin 2026",
    "profile": "Équilibré",
    "version": "v1"
  },
  "_provisional_ids": true,
  "financier_cote": [
    {
      "entity_id": "tmp_ent_001",
      "label": "Assurance-vie — UAF Life Patrimoine (Pollux)",
      "envelope_type": "AV",
      "manager": "Rhétorès",
      "value_current": 80435.07,
      "capital_invested": 70000,
      "invest_date": "2022-12-14",
      "value_jan1": 81018.39006657315,
      "management_mode": "Conseillée",
      "risk_profile": "Équilibré",
      "source_document": "Catégories et Perf HANAMI_T2 2026.xlsx",
      "validated_by": "thomas.giovanopoulos@rhetores.com",
      "attributes": {
        "lines": [
          {
            "label": "SELECT APPROCHE GLOBALE",
            "isin": "FR001400LQV8",
            "value": 24923.67,
            "class": "alternatifs",
            "perf_pct": 4.39,
            "geography": "monde"
          },
          {
            "label": "Piquemal Houghton Global Equities R EUR",
            "isin": "LU2261172451",
            "value": 15404.54,
            "class": "actions",
            "perf_pct": -7.5,
            "geography": "monde"
          },
          {
            "label": "M&G (Lux) Global Dividend Fund A EUR Acc",
            "isin": "LU1670710075",
            "value": 9503.33,
            "class": "actions",
            "perf_pct": 40.6,
            "geography": "monde"
          },
          {
            "label": "IVO Emerging Markets Corporate Debt EUR-R",
            "isin": "LU1165644672",
            "value": 8672.22,
            "class": "obligations",
            "perf_pct": 28.31,
            "geography": "emergents"
          },
          {
            "label": "Pictet TR-Mandarin HP EUR Acc",
            "isin": "LU0496443887",
            "value": 5294.22,
            "class": "actions",
            "perf_pct": 11.26,
            "geography": "emergents"
          },
          {
            "label": "Pictet TR Atlas Titan P EUR",
            "isin": "LU2206556016",
            "value": 4967.31,
            "class": "alternatifs",
            "perf_pct": 4.39
          },
          {
            "label": "Pictet TR-Sirius P USD Acc",
            "isin": "LU1799936197",
            "value": 4947.04,
            "class": "alternatifs",
            "perf_pct": 3.97
          },
          {
            "label": "Clartan Europe C",
            "isin": "LU1100076808",
            "value": 4575.41,
            "class": "actions",
            "perf_pct": 13.69,
            "geography": "europe"
          },
          {
            "label": "LO Funds All Roads EUR PA",
            "isin": "LU0718509606",
            "value": 2044.44,
            "class": "alternatifs",
            "perf_pct": 20.99
          },
          {
            "label": "Fonds Euro Nouvelle Génération",
            "value": 102.89,
            "class": "alternatifs"
          }
        ],
        "pockets": [
          {
            "label": "Assurance-vie — UAF Life Patrimoine (Pollux)",
            "value": 80435.07,
            "manager": "Rhétorès",
            "profile": "Équilibré",
            "capital_invested": 70000,
            "value_jan1": 81018.39006657315,
            "invest_date": "2022-12-14"
          }
        ]
      },
      "id": "tmp_fc_001"
    },
    {
      "entity_id": "tmp_ent_001",
      "label": "Assurance-vie — UAF Life Patrimoine (Cerise)",
      "envelope_type": "AV",
      "manager": "Rhétorès",
      "value_current": 79505.18,
      "capital_invested": 70000,
      "invest_date": "2022-12-14",
      "value_jan1": 80533.16511477315,
      "management_mode": "Conseillée",
      "risk_profile": "Équilibré",
      "source_document": "Catégories et Perf HANAMI_T2 2026.xlsx",
      "validated_by": "thomas.giovanopoulos@rhetores.com",
      "attributes": {
        "lines": [
          {
            "label": "SELECT APPROCHE GLOBALE",
            "isin": "FR001400LQV8",
            "value": 24904.16,
            "class": "alternatifs",
            "perf_pct": 3.81,
            "geography": "monde"
          },
          {
            "label": "Piquemal Houghton Global Equities R EUR",
            "isin": "LU2261172451",
            "value": 15452.88,
            "class": "actions",
            "perf_pct": -7.85,
            "geography": "monde"
          },
          {
            "label": "M&G (Lux) Global Dividend Fund A EUR Acc",
            "isin": "LU1670710075",
            "value": 9503.33,
            "class": "actions",
            "perf_pct": 40.6,
            "geography": "monde"
          },
          {
            "label": "IVO Emerging Markets Corporate Debt EUR-R",
            "isin": "LU1165644672",
            "value": 8672.22,
            "class": "obligations",
            "perf_pct": 28.31,
            "geography": "emergents"
          },
          {
            "label": "Pictet TR-Mandarin HP EUR Acc",
            "isin": "LU0496443887",
            "value": 5281.55,
            "class": "actions",
            "perf_pct": 10.24,
            "geography": "emergents"
          },
          {
            "label": "Pictet TR-Sirius P USD Acc",
            "isin": "LU1799936197",
            "value": 4970.5,
            "class": "alternatifs",
            "perf_pct": 3.75
          },
          {
            "label": "Pictet TR Atlas Titan P EUR",
            "isin": "LU2206556016",
            "value": 4967.86,
            "class": "alternatifs",
            "perf_pct": 3.69
          },
          {
            "label": "Comgest Renaissance Europe C",
            "isin": "FR0000295230",
            "value": 3605.35,
            "class": "actions",
            "perf_pct": -10.42,
            "geography": "europe"
          },
          {
            "label": "LO Funds All Roads EUR PA",
            "isin": "LU0718509606",
            "value": 2044.44,
            "class": "alternatifs",
            "perf_pct": 20.99
          },
          {
            "label": "Fonds Euro Nouvelle Génération",
            "value": 102.89,
            "class": "alternatifs"
          }
        ],
        "pockets": [
          {
            "label": "Assurance-vie — UAF Life Patrimoine (Cerise)",
            "value": 79505.18,
            "manager": "Rhétorès",
            "profile": "Équilibré",
            "capital_invested": 70000,
            "value_jan1": 80533.16511477315,
            "invest_date": "2022-12-14"
          }
        ]
      },
      "id": "tmp_fc_002"
    },
    {
      "entity_id": "tmp_ent_002",
      "label": "Capitalisation — Generali Patrimoine (HIMALIA)",
      "envelope_type": "Capi",
      "manager": "Rhétorès",
      "value_current": 257171.07,
      "capital_invested": 200000,
      "invest_date": "2022-02-25",
      "value_jan1": 242173.110167558,
      "management_mode": "Conseillée",
      "risk_profile": "Équilibré",
      "source_document": "Catégories et Perf HANAMI_T2 2026.xlsx",
      "validated_by": "thomas.giovanopoulos@rhetores.com",
      "attributes": {
        "lines": [
          {
            "label": "Amundi Bloomberg Equal-weight Commodity ex-Agriculture UCITS ETF Acc EUR",
            "isin": "LU1829218749",
            "value": 59240.76,
            "class": "actions",
            "perf_pct": 38.84
          },
          {
            "label": "Pictet TR-Sirius P USD Acc",
            "isin": "LU1799936197",
            "value": 39884.07,
            "class": "alternatifs",
            "perf_pct": 2.84
          },
          {
            "label": "SELECT APPROCHE GLOBALE",
            "isin": "FR001400LQV8",
            "value": 39640.14,
            "class": "alternatifs",
            "perf_pct": 2.22,
            "geography": "monde"
          },
          {
            "label": "Axiom Emerging Markets Corporate Bonds RC EUR",
            "isin": "LU2821740573",
            "value": 22154.87,
            "class": "obligations",
            "perf_pct": 1.47,
            "geography": "emergents"
          },
          {
            "label": "Carmignac Emergents A EUR Acc",
            "isin": "FR0010149302",
            "value": 13798.52,
            "class": "actions",
            "perf_pct": 26.4,
            "geography": "emergents"
          },
          {
            "label": "Edmond de Rothschild SICAV EdR SICAV Global Resilience A-EUR",
            "isin": "FR001400RZ04",
            "value": 10891.25,
            "class": "actions",
            "perf_pct": -0.23,
            "geography": "monde"
          },
          {
            "label": "OFI Energy Strategic Metals R",
            "isin": "FR0014008NN3",
            "value": 9679.61,
            "class": "matieres_premieres",
            "perf_pct": -12.42,
            "geography": "monde"
          },
          {
            "label": "Piquemal Houghton Global Equities R EUR",
            "isin": "LU2261172451",
            "value": 8993.11,
            "class": "actions",
            "perf_pct": 34.04,
            "geography": "monde"
          },
          {
            "label": "GemEquity R",
            "isin": "FR0011268705",
            "value": 8358.94,
            "class": "actions",
            "perf_pct": 58.78,